[
  {
    "id": "22222222-2222-4222-8222-000000000001",
    "type": "mcq",
    "domain": "mlops-infra",
    "topic": "Workspace",
    "difficulty": 1,
    "source": "bank",
    "tags": ["mlops-infra", "workspace", "level-1"],
    "content": {
      "question": "Which Azure resources are provisioned by default when you create an Azure Machine Learning workspace?",
      "options": {
        "A": "Storage account, Key Vault, Application Insights, and Container Registry",
        "B": "Storage account and Key Vault only",
        "C": "Storage account, Key Vault, Container Registry, and a default compute cluster",
        "D": "Storage account, SQL Database, and Application Insights"
      },
      "correct": "A",
      "explanation": "An Azure ML workspace automatically provisions a storage account (default datastore), a Key Vault (secrets), Application Insights (telemetry), and a Container Registry (environment images). Compute is NOT auto-provisioned — you create compute instances or clusters separately."
    }
  },
  {
    "id": "22222222-2222-4222-8222-000000000002",
    "type": "mcq",
    "domain": "mlops-infra",
    "topic": "Compute",
    "difficulty": 2,
    "source": "bank",
    "tags": ["mlops-infra", "compute", "level-2"],
    "content": {
      "question": "You need to run a hyperparameter sweep with 50 parallel trials, each requesting one GPU node. Which compute target is appropriate?",
      "options": {
        "A": "A compute instance with 1 GPU node",
        "B": "A compute cluster with min_instances=0 and max_instances=50",
        "C": "Azure Kubernetes Service cluster attached to the workspace",
        "D": "A serverless endpoint with concurrency=50"
      },
      "correct": "B",
      "explanation": "Compute clusters auto-scale between min and max instances, are designed for non-interactive parallel jobs (sweeps, pipelines), and scale to zero when idle. Compute instances are single-node and not suitable for parallel trials. AKS is for inference, not training sweeps. Serverless endpoints serve inference, not training."
    }
  },
  {
    "id": "22222222-2222-4222-8222-000000000003",
    "type": "mcq",
    "domain": "mlops-infra",
    "topic": "Environments",
    "difficulty": 2,
    "source": "bank",
    "tags": ["mlops-infra", "environments", "level-2"],
    "content": {
      "question": "Which approach makes an Azure ML environment reproducible across the team?",
      "options": {
        "A": "Install packages with `pip install` at the start of each training script",
        "B": "Register a versioned environment defined by a Docker image and a conda.yml, and reference it by name and version in every job",
        "C": "Use the default curated environment without pinning versions",
        "D": "Commit a requirements.txt to the repo and have each user create their own environment"
      },
      "correct": "B",
      "explanation": "Registered environments with a Docker image plus pinned conda.yml/requirements give a stable, version-addressable runtime that every job references identically. Inline pip installs drift over time. Default curated environments aren't pinned to a project. Per-user environments diverge across the team."
    }
  },
  {
    "id": "22222222-2222-4222-8222-000000000004",
    "type": "mcq",
    "domain": "mlops-infra",
    "topic": "GitHub Integration",
    "difficulty": 2,
    "source": "bank",
    "tags": ["mlops-infra", "github-integration", "level-2"],
    "content": {
      "question": "How should an Azure ML GitHub Actions workflow authenticate to the workspace?",
      "options": {
        "A": "Hardcode the service principal client secret in the workflow YAML",
        "B": "Use OpenID Connect (OIDC) with a federated credential on a user-assigned managed identity or app registration",
        "C": "Use the workspace's storage account key as a workflow input",
        "D": "Prompt for credentials at workflow runtime via `az login`"
      },
      "correct": "B",
      "explanation": "OIDC with federated credentials is the recommended pattern: GitHub Actions exchanges a workflow-scoped token for an Azure access token without long-lived secrets stored in the repo. Hardcoded secrets are a leak risk; storage keys grant too much; interactive login isn't possible in CI."
    }
  },
  {
    "id": "22222222-2222-4222-8222-000000000005",
    "type": "mcq",
    "domain": "mlops-infra",
    "topic": "Registries",
    "difficulty": 2,
    "source": "bank",
    "tags": ["mlops-infra", "registries", "level-2"],
    "content": {
      "question": "What is an Azure ML registry used for?",
      "options": {
        "A": "Sharing models, environments, and components across multiple workspaces in an organization",
        "B": "Storing raw training datasets",
        "C": "Hosting Docker images only (replaces Azure Container Registry)",
        "D": "Tracking experiment runs across workspaces"
      },
      "correct": "A",
      "explanation": "An Azure ML registry is an organization-scoped catalog for sharing reusable assets — models, environments, components, and data — across many workspaces. ACR still holds the underlying Docker images. Datasets live in datastores or registries. Run tracking is per-workspace (MLflow)."
    }
  },
  {
    "id": "22222222-2222-4222-8222-000000000006",
    "type": "mcq",
    "domain": "ml-lifecycle",
    "topic": "Hyperparameter Tuning",
    "difficulty": 2,
    "source": "bank",
    "tags": ["ml-lifecycle", "hyperparameter-tuning", "level-2"],
    "content": {
      "question": "Which sampling algorithm is INVALID with a continuous `Normal()` hyperparameter expression in an Azure ML sweep job?",
      "options": {
        "A": "Random",
        "B": "Bayesian",
        "C": "Grid",
        "D": "Sobol"
      },
      "correct": "C",
      "explanation": "Grid sampling requires every hyperparameter expression to be discrete (`Choice`). A `Normal()` distribution is continuous and incompatible with grid. Random and Bayesian both support continuous distributions. Sobol is supported as a quasi-random alternative for continuous spaces."
    }
  },
  {
    "id": "22222222-2222-4222-8222-000000000007",
    "type": "mcq",
    "domain": "ml-lifecycle",
    "topic": "Hyperparameter Tuning",
    "difficulty": 3,
    "source": "bank",
    "tags": ["ml-lifecycle", "hyperparameter-tuning", "level-3"],
    "content": {
      "question": "Which sweep job setup is INCOMPATIBLE with a `BanditPolicy` early-termination policy?",
      "options": {
        "A": "Bayesian sampling with a `slack_factor` of 0.1",
        "B": "Random sampling with `evaluation_interval=1` and `delay_evaluation=5`",
        "C": "Grid sampling with `slack_amount=0.05` and `delay_evaluation=10`",
        "D": "Bayesian sampling — Bayesian does not support early termination"
      },
      "correct": "D",
      "explanation": "Bayesian sampling is incompatible with ALL early-termination policies (Bandit, MedianStopping, TruncationSelection) because Bayesian uses prior trial results to plan future trials, which conflicts with terminating trials early. Random and Grid both support Bandit. The other options are valid configurations."
    }
  },
  {
    "id": "22222222-2222-4222-8222-000000000008",
    "type": "mcq",
    "domain": "ml-lifecycle",
    "topic": "AutoML",
    "difficulty": 2,
    "source": "bank",
    "tags": ["ml-lifecycle", "automl", "level-2"],
    "content": {
      "question": "Your AutoML classification job fails immediately on submission with a data type error. The training data is registered as a `uri_file` data asset pointing to a CSV. What's wrong?",
      "options": {
        "A": "AutoML cannot read CSV files; convert to Parquet",
        "B": "AutoML requires the training data to be an `MLTable` data asset, not `uri_file`",
        "C": "AutoML requires the data to be in Azure Data Lake Gen2, not Blob storage",
        "D": "AutoML requires the data to be split into train/validation/test files before submission"
      },
      "correct": "B",
      "explanation": "AutoML v2 requires training data as an MLTable asset; MLTable wraps the file with schema definitions (column types, target column) that AutoML validates at job submission. `uri_file` has no schema and fails validation. CSV inside an MLTable is supported. AutoML can split data itself."
    }
  },
  {
    "id": "22222222-2222-4222-8222-000000000009",
    "type": "mcq",
    "domain": "ml-lifecycle",
    "topic": "Pipelines",
    "difficulty": 2,
    "source": "bank",
    "tags": ["ml-lifecycle", "pipelines", "level-2"],
    "content": {
      "question": "You submit a pipeline job and it fails with a 'compute is required' error before any step runs. What's the most likely cause?",
      "options": {
        "A": "The compute cluster has not finished provisioning",
        "B": "The pipeline has no `default_compute` in `settings` and at least one component has no `compute=` set",
        "C": "The workspace quota is exceeded",
        "D": "The components are using incompatible environment images"
      },
      "correct": "B",
      "explanation": "Every component invocation must resolve to a compute target. Setting `pipeline_job.settings.default_compute` covers all unspecified components; otherwise each component must set its own `compute=`. Missing both produces a submit-time error before any step starts. Quota and environment issues fail later at step run time."
    }
  },
  {
    "id": "22222222-2222-4222-8222-000000000010",
    "type": "mcq",
    "domain": "ml-lifecycle",
    "topic": "Online Endpoints",
    "difficulty": 2,
    "source": "bank",
    "tags": ["ml-lifecycle", "online-endpoints", "level-2"],
    "content": {
      "question": "Which deployment strategy lets you route a small percentage of production traffic to a new model version while keeping the previous version serving the rest?",
      "options": {
        "A": "Create a second online endpoint and switch DNS",